CODE_THEME;CD_THEMA;abbr;theme;CD_PARENT_DIVNAME;NEW_PARENT;LEVEL_NEW;CD_LEVEL
ACGG;EU.3.7.7.;;Enhance stadardisation and interoperability of systems, including for emergency purposes;EU.3.7.;ACG;4;5
ACGH;EU.3.7.8.;;Support the Union's external security policies including through conflict prevention and peace-building;EU.3.7.;ACG;4;5
ACZ;EU.3.0.;SOCCHAL-CROSST;Societal Challenges - Cross-theme;EU.3.;AC;3;
AD;EU.4.;WIDENING;Spreading excellence and widening participation;EC;A;2;3
ADA;EU.4.a.;WIDESPREAD;Teaming of excellent research institutions and low performing RDI regions;EU.4.;AD;3;4
ADB;EU.4.b.;TWINING;Twinning of research institutions;EU.4.;AD;3;4
ADC;EU.4.c.;ERA;ERA chairs;EU.4.;AD;3;4
ADD;EU.4.d.;PSF;Policy Support Facility (PSF);EU.4.;AD;3;4
ADE;EU.4.e.;INTNET;Supporting access to international networks;EU.4.;AD;3;4
ADF;EU.4.f.;NCPNET;Transnational networks of National Contact Points;EU.4.;AD;3;4
ADZ;EU.4.0.;SEAWP-CROSST;Spreading excellence and widening participation - Cross-theme;EU.4.;AD;3;
AE;EU.5.;SWAFS;Science with and for Society;EC;A;2;3
AEA;EU.5.a.;CAREER;Make scientific and technological careers attractive for young people;EU.5.;AE;3;4
AEB;EU.5.b.;GENDEREQ;Promote gender equality in research and innovation;EU.5.;AE;3;4
AEC;EU.5.c.;INEGSOC;Integrate society in science and innovation;EU.5.;AAE;3;4
AED;EU.5.d.;SCIENCE;Encourage citizens to engage in science;EU.5.;AE;3;4
AEE;EU.5.e.;RESACCESS;Develop the accessibility and the use of the results of publicly-funded research;EU.5.;AE;3;4
AEF;EU.5.f.;GOV;Develop the governance for the advancement of responsible research and innovation;EU.5.;AE;3;4
AEG;EU.5.g.;IMPACT;Anticipating and assessing potential environmental, health and safety impacts;EU.5.;AE;3;4
AEH;EU.5.h.;KNOWLEDGE;Improve knowledge on science communication;EU.5.;AE;3;4
AEZ;EU.5.0.;SWAFS-CROSST;Science with and for Society - Cross-theme;EU.5.;AE;3;
AF;EU.6.;JRC;Non-nuclear direct actions of the Joint Research Centre (JRC);EC;A;2;3
AG;EU.7.;EIT;The European Institute of Innovation and Technology (EIT);EC;A;2;3
AGA;;Climate;Climate;;AG;3;
AGB;;Digital;Digital;;AG;3;
AGC;;Health;Health;;AG;3;
AGD;;InnoEnergy;InnoEnergy;;AG;3;
AGE;;Raw Materials;Raw Materials;;AG;3;
AT;Euratom;EURATOM;Euratom;H2020;A;2;
ATA;Euratom-1.;Indirect actions;Indirect actions;Euratom;AT;3;3
ATAA;Euratom-1.1.;;Support safe operation of nuclear systems;Euratom-1.;ATA;4;4
ATAB;Euratom-1.2.;;Contribute to the development of solutions for the management of ultimate nuclear waste;Euratom-1.;ATA;4;4
ATAC;Euratom-1.3.;;Support the development and sustainability of nuclear competences at Union level;Euratom-1.;ATA;4;4
ATAD;Euratom-1.4.;;Foster radiation protection;Euratom-1.;ATA;4;4
ATAE;Euratom-1.5.;;Move toward demonstration of feasibility of fusion as a power source by exploiting existing and future fusion facilities;Euratom-1.;ATA;4;4
ATAF;Euratom-1.6.;;Lay the foundations for future fusion power plants by developing materials, technologies and conceptual design;Euratom-1.;ATA;4;4
ATAG;Euratom-1.7.;;Promote innovation and industry competitiveness;Euratom-1.;ATA;4;4
ATAH;Euratom-1.8.;;Ensure availability and use of research infrastructures of pan_european relevance;Euratom-1.;ATA;4;4
ATAI;Euratom-1.9.;;European Fusion Development Agreement;Euratom-1.;ATA;4;4
ATB;Euratom-2.;JRC direct actions;JRC direct actions;Euratom;AT;3;3
AZ;EU.0.;FTIPilot;Fast Track to Innovation Pilot;EC;A;2;
;EC;;EC Treaty;;;;
;EU.2.1.;;Leadership in enabling and industrial technologies (LEIT);;;;
